Question,Answer,Avg_Sentiment
Does the product last long?,good product also | good product | product good | best product go | good product must buying product k,0.76
How is the user experience?,ipad awesome nice display smoother experience sound quality also good camera good loved tab | amazing experience ipad world apple first ipad trading purpose must need type buttering explore | using ipad monthsi bought one niece threw tantrum saw ipadin experience using ipad first time one fast iphone clicked decent document picture able play heavy mobile game like genshin impact never dying battery nice big displaywhat else want | recently purchased ipad th generation gb storage wifi connectivity thrilled share overwhelmingly positive experience outstanding devicefrom sleek design powerful performance ipad truly exceeded expectation every way first foremost th generation ipads gb storage capacity absolute gamechangerit provides ample space storing vast array file document photo video application read | perfect one digital artist worth money,0.39
Does it deliver good value for the price?,good product got affordable price table salebut normal price far productgot product amazing price | good | good | good | good,0.64
Are there frequent technical issues?,value money product | best student value money really good optimisation | extremely happy purchase although display better around k worth money | thank much flipkart apple | awesome,0.52
Would you recommend this product to others?,good product also | good product | product good | best product go | good product must buying product k,0.76
